,product_id,star_rating,total_votes,helpful_votes,review_body,possentiment,neusentiment,negsentiment,reviews
0,B0083PWAPW,4,0,0,not iPad but does everything iPad does for fraction the price Despite having its neutered amazon into something close garbage this excellent tablet for the price before you waste your hard earned dollars something just because has piece fruit stamped the back yourself favor and check this one out few gripes the built video and browser apps are terrible part ones have installed the carousel kind nice touch but makes near impossible with shortcuts and links despite being android not Google friendly which pain Amazon can get around most the issues with this product except for the inability link with Google apps and products easily Make google your friend and rule the tablet world,0.14,0.767,0.09300000000000001,ipad everything ipad fraction price despite neutered amazon something close garbage excellent tablet price waste hard earned dollars something piece fruit stamped back favor check one gripes built video browser apps terrible part ones installed carousel kind nice touch makes near impossible shortcuts links despite android google friendly pain amazon around issues product except inability link google apps products easily make google friend rule tablet world
1,B00BWYRF7E,3,1,1,have been long time supporter Kindles and went from the gen Kindle Fire this one While the display bright and better than the gen Fire prefer the gen for the way content organized the home screen,0.153,0.754,0.09300000000000001,long time supporter kindles went gen kindle fire one while display bright better gen fire prefer gen way content organized home screen
2,B0083Q04IQ,5,0,0,the kindle almost best friend love love love hate what doing the print industry tho,0.486,0.41200000000000003,0.102,kindle almost best friend love love love hate print industry tho
3,B0083PWAPW,1,1,1,with this product have owned this product for less than years and longer works was online with Amazon tech tonight hoping that they could but luck They offered discount new one which appreciate but not sure want burned again down the drain,0.162,0.6859999999999999,0.152,product owned product less years longer works online amazon tech tonight hoping could luck they offered discount new one appreciate sure want burned drain
4,B0051VVOB2,5,1,1,love the graphics first all love that have all books that want read right finger tips would not trade fire for any other tablet This must have,0.29100000000000004,0.7090000000000001,0.0,love graphics first love books want read right finger tips trade fire tablet this must
5,B0083PWAPW,3,3,2,have say that never intended get kindle fire But after neice got the Fire for really liked the new design and thought was cool decided buy one and decided upgrade the Fire have say nice looking and pretty cool but kinda not believe deserves stars for few reasons First off can not understand why they can not supply faster charger for this thing hours charge ridiculous Who really wants wait half day play with again You can buy the rapid charger which did and that another story will get but you not buy same time kindle will cost you crazy your going get Fire buy the rapid charger did buy the charger the same time and was shipped the same day but guess what still have not got charger prime member and should have gotten the same day kindle but still waiting Another thing charged Fire all night and played with for about hours and was dead and needed another charge now can play with again tomorrow Yes did download songs from cloud and checked out one video for about minutes downloaded apps and then shut off the wireless played angry birds and read few pages from book But after hours had recharge Seems little nuts for device that costs have such fast battey run down The most thing the camera that come with your Fire that you paid for does NOT work That right folks you have buy app that makes work could NOT believe still can could not figure out how turn until read that you have buy app for work nuts can not understand why you not get some kind book read how use the stupid thing went the amazon site and found the info how use but come and small short book would have been nice guess overall its not bad device and its kinda neat The picture nice and the speakers are really nice but those things alone does not just giving stars feel would have been star the charger was included the battery was little longer and the damn camera actually worked without buying app make work little this Kindle especially since paid for love Amazon but they really goofed this one was brought attention that there app under photos the top corner for the camera did not see and will have try tomorrow find because have wait hours for fire charge will update figure out This why book with this kind would nice have Amazon short book would have been nice guess overall its not bad device and its kinda neat The picture nice and the speakers are really nice but those things alone does not just giving stars feel would have been star the charger was included the battery was little longer and the damn camera actually worked without buying app make work little this Kindle especially since paid for love Amazon but they really goofed this one was brought attention that there app under photos the top corner for the camera did not see and will have try tomorrow find because have wait hours for fire charge will update figure out This why book with this kind would nice have Amazon,0.11,0.7959999999999999,0.094,say never intended kindle fire but neice fire really liked new design thought cool decided buy one decided upgrade fire say nice looking pretty cool kinda believe deserves stars reasons first understand supply faster charger thing hours charge ridiculous who really wants wait half day play you buy rapid charger another story buy time kindle cost crazy going fire buy rapid charger buy charger time shipped day guess still charger prime member gotten day kindle still waiting another thing charged fire night played hours dead needed another charge play tomorrow yes download songs cloud checked one video minutes downloaded apps shut wireless played angry birds read pages book but hours recharge seems little nuts device costs fast battey run the thing camera come fire paid not work that right folks buy app makes work could not believe still could figure turn read buy app work nuts understand kind book read stupid thing went amazon site found info come small short book nice guess overall bad device kinda neat the picture nice speakers really nice things alone giving stars feel star charger included battery little longer damn camera actually worked without buying app make work little kindle especially since paid love amazon really goofed one brought attention app photos top corner camera see try tomorrow find wait hours fire charge update figure this book kind nice amazon short book nice guess overall bad device kinda neat the picture nice speakers really nice things alone giving stars feel star charger included battery little longer damn camera actually worked without buying app make work little kindle especially since paid love amazon really goofed one brought attention app photos top corner camera see try tomorrow find wait hours fire charge update figure this book kind nice amazon
6,B0083PWAPW,5,0,0,This item good for reader all books not too familiar with the camera because faces you need practice with more use this item for facebook mails reading playing games love the free games This item would say its not above below would say fairly satisfied with just wish the camera was you could take pictures away from facing you Thank you,0.23399999999999999,0.7659999999999999,0.0,this item good reader books familiar camera faces need practice item facebook mails reading playing games love free games this item say say fairly satisfied wish camera could take pictures away facing thank
7,B0083PWAPW,1,0,0,Pretty much the whole Amazon Market sucks because doesnt have Google play like Apple product pretty much sucked you want honesty,0.41,0.46799999999999997,0.122,pretty much whole amazon market sucks doesnt google play like apple product pretty much sucked want honesty
8,B00BWYRF7E,5,1,1,Great graphics picture quality both pictures videos are really great The only negative the battery drain not really problem but was expecting the time recharge more than hours during high use Otherwise would highly recommend the Kindle Fire HDX model Happy with the speed storage space well have the model,0.242,0.687,0.071,great graphics picture quality pictures videos really great the negative battery drain really problem expecting time recharge hours high otherwise highly recommend kindle fire hdx model happy speed storage space well model
9,B0083PWAPW,5,1,1,this first tablet and love already owned the previous kindle reader and was pleased with when came time progress reasonably priced tablet chose the kindle fire couldn happier with decision ease operation and great graphics PERFECT,0.327,0.593,0.081,first tablet love already owned previous kindle reader pleased came time progress reasonably priced tablet chose kindle fire happier decision ease operation great graphics perfect
10,B0083Q04IQ,2,2,1,love this device much better than the Nook Problem the software literally the WORST EVER constantly have shut down the stupid thing and the moment taking forever write this because the little blinking line keeps going back the start this review that have keep deleting words behind the first letter also lags Lot The sorts all apps and similar things what you used last played Temple Run most recently that app would the front the line The line out the correct order and any app you plan pay just flat out doesn work and you can anything When problems such these occur most,0.07,0.8079999999999999,0.122,love device much better nook problem software literally worst ever constantly shut stupid thing moment taking forever write little blinking line keeps going back start review keep deleting words behind first letter also lags lot the sorts apps similar things used last played temple run recently app front line the line correct order app plan pay flat work anything when problems occur
11,B00BWYQ9YE,4,0,0,have owned and enjoyed the inch Fire and Fire Just received the Fire HDX inch very easy set and much faster than the Fire will hopefully replace Email Words with friends etc work great the HDX Instead replacing the Fire use both the and HDX now because the HDX does not have the Zinga Poker app which the device The Mayday which great rep said Zinga Poker has not written the spec for the HDX yet had know the HDX missing apps used playing the would have not upgraded the HDX until everything that had the was available the HDX Hope this helps,0.124,0.778,0.098,owned enjoyed inch fire fire just received fire hdx inch easy set much faster fire hopefully replace email words friends etc work great hdx instead replacing fire hdx hdx zinga poker app device the mayday great rep said zinga poker written spec hdx yet know hdx missing apps used playing upgraded hdx everything available hdx hope helps
12,B0083PWAPW,5,1,1,chose this rating cause this how feel The Kindle Fire awesome everything can want tablet recommend this all friends and everybody else take mind everywhere love order came right time Thanks,0.324,0.634,0.042,chose rating cause feel the kindle fire awesome everything want tablet recommend friends everybody else take mind everywhere love order came right time thanks
13,B0051VVOB2,5,2,1,Love Kindle Fire had buy one for friend and planning getting one for son ventures off school Would recommend this product for those who want something different that the normal life,0.24,0.7120000000000001,0.049,love kindle fire buy one friend planning getting one son ventures school would recommend product want something different normal life
14,B00BWYQ9YE,5,1,0,ordered this holiday gift for love love the color bright love the prime film making movie watching easy would like amazon hook with edge get another choice for holder one with room store the charging cord,0.433,0.5670000000000001,0.0,ordered holiday gift love love color bright love prime film making movie watching easy like amazon hook edge another choice holder one room store charging cord
15,B00BWYQ9YE,2,3,1,have been iOS user since the very first iPad also own iPhone However pretty much hate the User Interface iOS and find the phone too small for web browsing iPad old that web pages overload the internal memory and cause crashes decided the time was right start exploring Android found the Amazon interface confusing Too much going also really don like how limited the Amazon store but understand the business model them offering the tablet cheaper for that reason the end figured could live with the for was wrong The problem not Android going end buying Nexus also have decided not like the inch tablet form factor but for some reason found web pages the Nexus inch easier read than the Fire HDX inch Perhaps there font difference,0.051,0.857,0.092,ios user since first ipad also iphone however pretty much hate user interface ios find phone small web browsing ipad old web pages overload internal memory cause crashes decided time right start exploring android found amazon interface confusing too much going also really like limited amazon store understand business model offering tablet cheaper reason end figured could live wrong the problem android going end buying nexus also decided like inch tablet form factor reason found web pages nexus inch easier read fire hdx inch perhaps font difference
16,B00BWYQ9YE,5,0,0,bought this for daughter for Christmas and she hasn put down since can see why there are parental controls now She can play games watch movies read books and and Customer Service was awesome,0.217,0.7829999999999999,0.0,bought daughter christmas put since see parental controls she play games watch movies read books customer service awesome
17,B0083PWAPW,5,0,0,Its perfectic for like read and play different games when traveling works great for like the size and the color screen easy the eyes can browes the internet and facebook too Great weather app whats not love,0.298,0.649,0.053,its perfectic like read play different games traveling works great like size color screen easy eyes browes internet facebook great weather app whats love
18,B0083Q04IQ,4,0,0,easy use but would like you had put password every time you made purchase because son the one who uses the most,0.14800000000000002,0.852,0.0,easy like put password every time made purchase son one uses
19,B0083PWAPW,2,4,1,the Kindle fine for email reading books and magazines and for Facebook type stuff The internet browser sucks Many online videos will not play the Kindle Unless all you want email and read books would suggest something else,0.066,0.836,0.09699999999999999,kindle fine email reading books magazines facebook type stuff the internet browser sucks many online videos play kindle unless want email read books suggest something else
20,B0083Q04IQ,5,0,0,love with kindle fire wish had and know could buy one with but don want spend that much Other than that family gets ton enjoyment from this awesome product And kindle support awesome,0.371,0.583,0.046,love kindle fire wish know could buy one want spend much other family ton enjoyment awesome product and kindle support awesome
21,B0051VVOB2,5,6,5,bought the Fire Christmas present myself had some second thoughts after reading some the negative reviews held off until Christmas unwrap the package and couldn have been more surprised The Fire has operated promised Too many reviewers tried compare the Fire with IPAD which not exactly what Amazon advertised find the Silk browser fast desktop the display awesome steaming content plays without and using the Fire intuitive promised the Fire media device with the added ability access the internet and email allows avoid booting desktop just for quick email check web search sure there are more apps that could install but far everything that want think need has been available including Angry Birds There are still features haven used such the Cloud but time goes expect the Fire will handle them seemlessly The only thing find even bit rather narrow selection free media Prime The hype with Prime was there were thousands free video and text available sure there are one was count but the question how many them would consumer really want view read All all the Fire great buy and will most likely purchase second one for wife,0.129,0.772,0.099,bought fire christmas present second thoughts reading negative reviews held christmas unwrap package surprised the fire operated promised too many reviewers tried compare fire ipad exactly amazon advertised find silk browser fast desktop display awesome steaming content plays without using fire intuitive promised fire media device added ability access internet email allows avoid booting desktop quick email check web search sure apps could install far everything want think need available including angry birds there still features used cloud time goes expect fire handle seemlessly the thing find even bit rather narrow selection free media prime the hype prime thousands free video text available sure one count question many consumer really want view read all fire great buy likely purchase second one wife
22,B0051VVOB2,5,0,0,you read all you need Kindle easy use words big enough where you don have problem reading any situation Amazon has enough Free stuff you join Prime keep you reading forever Down loading games for the most part are cheep not free and the books are cheap and bunch free ones real hold plane car bed night sitting your favorite chair you prefer standing line airport,0.17300000000000001,0.777,0.05,read need kindle easy words big enough problem reading situation amazon enough free stuff join prime keep reading forever down loading games part cheep free books cheap bunch free ones real hold plane car bed night sitting favorite chair prefer standing line airport
23,B0051VVOB2,4,3,2,have both iPad and kindle fire They both have their places The fire does exactly what was advertised need bash for being value oriented tablet think the fire going great for traveling thanks its small size and light weight There are few quirks with the software but this common with brand new device The default news stand view little annoying would nice able customize the main interface This does however keep the device better organized than the iPad the amazon app store expands and they bring instant videos will really help the case for amazon tablet market,0.155,0.772,0.073,ipad kindle fire they places the fire exactly advertised need bash value oriented tablet think fire going great traveling thanks small size light weight there quirks software common brand new device the default news stand view little annoying nice able customize main interface this however keep device better organized ipad amazon app store expands bring instant videos really help case amazon tablet market
24,B0083Q04IQ,4,0,0,recently passed years work and one the items available for service award was gen Kindle Fire Got for free Sure cannot beat that price far happy with the device itself Was easy set and get working Connected home network with problems Was already member Amazon Prime downloaded freebie short story from the Kindle Lending Library make sure that worked Went good problem also subscribe Netflix Downloaded the Kindle app for that and seems work fine Just you know you buy app via your install later the Kindle will not show the cloud patient will get there Would nice Kindle had Flash Player but knew ahead time that was not the case Not the fault Amazon Kindle Adobe decided that they would longer support Flash the Android platform Next found link the Open Library project org the Amazon site This one the sites where thousands ebooks are available borrowed cost This where got first bad surprise Some the older books the archive are available for download MOBI PDF ePub formats Some also have the Send Kindle option which Amazon may may not charge fee for EVERY ONE the more modern books was interested had only reading options The first was format that delivered your browser real time You cannot download that format read later off line The two formats that can downloaded for later reading are protected PDF and protected ePub These formats least through Open Library must managed via Adobe Digital Editions which Kindle does not support yeah there are lots books Open Library that was interested but cannot read them Kindle Also linked from Amazon Many Books manybooks net Most all their content Kindle compatible but Idid not see anything there was really interested There are probably other options out there the web big place have not had chance look yet but was Many Books and Open Library Update April may have jumped the gun bit Sorry Content that protected Adobe DRM cannot opened the Kindle reader but think there work around According the Adobe website their DRM software Adobe Digital Editions will work with the Aldiko reader app Aldiko can loaded onto the Kindle The Aldiko app the Amazon app store two versions The free version dumbed down and supported The premium version only and has advanced features and ads pretty busy right now cannot play around with this check out Will update this post again when get chance try out,0.133,0.782,0.085,recently passed years work one items available service award gen kindle fire got free sure cannot beat price far happy device was easy set working connected home network problems was already member amazon prime downloaded freebie short story kindle lending library make sure worked went good problem also subscribe netflix downloaded kindle app seems work fine just know buy app via install later kindle show cloud patient would nice kindle flash player knew ahead time case not fault amazon kindle adobe decided longer support flash android platform next found link open library project org amazon site this one sites thousands ebooks available borrowed cost this first bad surprise some older books archive available download mobi pdf epub formats some also send kindle option amazon may may charge fee every one modern books interested reading options the first format delivered browser real time you cannot download format read later line the two formats downloaded later reading protected pdf protected epub these formats least open library must managed via adobe digital editions kindle support yeah lots books open library interested cannot read kindle also linked amazon many books manybooks net most content kindle compatible idid see anything really interested there probably options web big place chance look yet many books open library update april may jumped gun bit sorry content protected adobe drm cannot opened kindle reader think work around according adobe website drm software adobe digital editions work aldiko reader app aldiko loaded onto kindle the aldiko app amazon app store two versions the free version dumbed supported the premium version advanced features ads pretty busy right cannot play around check will update post chance try
25,B0083Q04IQ,3,1,1,was surprised find that Kindle Fire had battery life only about hours stayed off WiFi and dimmed the brightness After several with the very nice people Amazon support exchanged device But the second not better This would not device for long trip when away from recharging capability for more than few hours Otherwise the device although heavier than had realized,0.17600000000000002,0.767,0.057,surprised find kindle fire battery life hours stayed wifi dimmed brightness after several nice people amazon support exchanged device but second better this device long trip away recharging capability hours otherwise device although heavier realized
26,B0083PWAPW,2,13,1,With all the hype this product bought hoping have fun with live Trinidad and you cannot get any apps this device once you live outside the states HONESTLY HATE THIS liability suggest Amazon should stop selling this device Countries where their apps are currently not supported,0.163,0.691,0.147,with hype product bought hoping fun live trinidad cannot apps device live outside states honestly hate this liability suggest amazon stop selling device countries apps currently supported
27,B0051VVOB2,5,4,3,bought the Kindle Fire for husband who has routinely opted Xoom for over year have say might have start stealing his Fire from time time smaller than used and lighter far The interface easy negotiate little too easy for liking with the carousel but husband good with and the whole device much more snappy than expected really impressed with the video streaming The resolution much better than thought and streamed just like more costly tablet without any problems weird buffering That said don like much for reading much prefer ink the backlit screen which the case with Xoom too others have mentioned haven yet figured out how get the page numbers progress meter reliably show which little vexing but not huge deal for,0.15,0.768,0.08199999999999999,bought kindle fire husband routinely opted xoom year say might start stealing fire time time smaller used lighter far the interface easy negotiate little easy liking carousel husband good whole device much snappy expected really impressed video streaming the resolution much better thought streamed like costly tablet without problems weird buffering that said like much reading much prefer ink backlit screen case xoom others mentioned yet figured page numbers progress meter reliably show little vexing huge deal
28,B00BWYQ9YE,5,0,0,great read and play games the kindle fire hdx because light can play read the dark and light,0.252,0.68,0.068,great read play games kindle fire hdx light play read dark light
