,product_id,star_rating,total_votes,helpful_votes,review_body,possentiment,neusentiment,negsentiment,reviews
269,B0051VVOB2,3,8,5,Fire Kindle loved the original and the Gen now called the Keyboard close perfection the ink style could have now had Fire for several months and true that use nearly daily Since read mostly news magazines and free current content rather than books the Pulse app the Fire one step using Calibre and cable each day side load content the Kindle Keyboard The sad part that nearly everything the Fire relies wifi the time you are reading including your own cloud library AND including magazine purchased content from Amazon Even can see the magazine cover carousel not near working hotspot can read complete articles the magazines have hotspot cell phone Verizon and whenever away from wifi work sitting beach nice park somewhere attempt use the Hotspot always get very strong connection phone kindle but rarely does this result web page actually opening the kindle the same location able browse the web with the phone evident the signal there since Amazon has chosen withhold the option for internet access despite the will looking the Apple very soon truly saddens that Amazon came CLOSE and yet chose deprive its loyal customers holding back this most important feature,0.107,0.8220000000000001,0.071,fire kindle loved original gen called keyboard close perfection ink style could fire several months true nearly daily since read mostly news magazines free current content rather books pulse app fire one step using calibre cable day side load content kindle keyboard the sad part nearly everything fire relies wifi time reading including cloud library and including magazine purchased content amazon even see magazine cover carousel near working hotspot read complete articles magazines hotspot cell phone verizon whenever away wifi work sitting beach nice park somewhere attempt hotspot always strong connection phone kindle rarely result web page actually opening kindle location able browse web phone evident signal since amazon chosen withhold option internet access despite looking apple soon truly saddens amazon came close yet chose deprive loyal customers holding back important feature
270,B0083PWAPW,5,0,0,Kindle Fire GETTING USED REALLY LIKE THEY SAID WOULD WILL DEFINITELY BUY FROM AMAZON AGAIN,0.321,0.603,0.076,kindle fire getting used really like they said would will definitely buy from amazon again
271,B0051VVOB2,5,2,2,For those the Kindle Fire please not mistake this with other tablets the market This first and foremost content consumer What mean that mean that you wish consider the Fire think about what you will use your tablet for you want something read books comics play apps check your email watch shows movies listen music then this device will all that well not great got mine the first day the and have been happily using daily since While does not have features that the iPad has the Android tablets also far cheaper than almost all them Negatives would that the speakers are both one side there means unless you are near wifi hotspot the memory only that you can utilize lack memory expansion slot and some the variety apps Now with those negatives the speaker one isn biggie the sound good and you want surround you aren really using the built ins any these devices rather ear buds headphones The lack constant contact the web while not always convenient isn all bad part the reason for the memory which will get but also becuase have smartphone need instant connection and would rather not add another data plan can Again costs are nicely minimized but there always downside that kind thing The memory tricky thing because like being able store loads songs movies and other content phone and Zune Well here with the the cloud and use their Prime service storage isn big deal can keep movies that look books couple albums apps that like using magazine and still have about left spare Would like the extra space yeah but need not really Reality that the extra storage space whilenice really crutch and having limitation least makes only keep things that really want use with Again this not swiss army knife solve any problem that arrises but rather power screw driver that has intended purposes with some utility but again designed for specific use and worrying griping about what can missing the forest for the trees The last thing about the variety apps more similar problem the magazines Not all them that want are out there yet but given time they likely will guess patience the key and willing not condemn out hand for that overall pleased with Fire lot various activities like and the price was great get take the plunge The size nice that easily hand held and large enough that does functions phone can due size while not being big unwieldy hope this helps others their This worthwhile tech opinion and well worth the money you are looking for something that can the things this does and like Amazon portal for content,0.136,0.809,0.055,for kindle fire please mistake tablets market this first foremost content consumer what mean mean wish consider fire think tablet want something read books comics play apps check email watch shows movies listen music device well great mine first day happily using daily since while features ipad android tablets also far cheaper almost negatives speakers one side means unless near wifi hotspot memory utilize lack memory expansion slot variety apps now negatives speaker one biggie sound good want surround really using built ins devices rather ear buds headphones the lack constant contact web always convenient bad part reason memory also becuase smartphone need instant connection rather add another data plan again costs nicely minimized always downside kind thing the memory tricky thing like able store loads songs movies content phone zune well cloud prime service storage big deal keep movies look books couple albums apps like using magazine still left spare would like extra space yeah need really reality extra storage space whilenice really crutch limitation least makes keep things really want again swiss army knife solve problem arrises rather power screw driver intended purposes utility designed specific worrying griping missing forest trees the last thing variety apps similar problem magazines not want yet given time likely guess patience key willing condemn hand overall pleased fire lot various activities like price great take plunge the size nice easily hand held large enough functions phone due size big unwieldy hope helps others this worthwhile tech opinion well worth money looking something things like amazon portal content
272,B0051VVOB2,5,2,2,Awesome product Great for reading browsing the Internet and playing games which all would use tablet for anyway don understand why everyone griping its great product great price,0.429,0.5710000000000001,0.0,awesome product great reading browsing internet playing games tablet anyway understand everyone griping great product great price
273,B0051VVOB2,4,7,0,absolutely LOVE Kindle Fire BUT why the world didn they make with Free like couple their other Kindle There are many wonderful features the Fire but when there WiFi available you are limited uses Just say,0.171,0.68,0.149,absolutely love kindle fire but world make free like couple kindle there many wonderful features fire wifi available limited uses just say
274,B0083PWAPW,5,0,0,Love glad bought Easy use and whole family enjoys Even the are having fun with,0.489,0.511,0.0,love glad bought easy whole family enjoys even fun
275,B0083PWAPW,1,10,9,have had kindle fire for months moderate user best and when used was only around the house Around months began have charging problems Amazon said was the charger and bought new one for saying the problem would fixed Didn work kept shutting down randomly had hard reset everytime wanted use and would still randomly shut down Although the Amazon help team was supportive eventually came down their admitting was software problem but the warranty had expired and there was nothing they could other than offer new one rate you can easily beat the internet There reason for the year warranty They can create produce that can last much longer than that totally don have tons and this was splurge for Check the internet there are lots blogs about this happening with the same results received from Amazon,0.076,0.84,0.084,kindle fire months moderate user best used around house around months began charging problems amazon said charger bought new one saying problem fixed didn work kept shutting randomly hard reset everytime wanted still randomly shut although amazon help team supportive eventually came admitting software problem warranty expired nothing could offer new one rate easily beat internet there reason year warranty they create produce last much longer totally tons splurge check internet lots blogs happening results received amazon
276,B0083PWAPW,3,7,0,One the most appealing features any mobile device the ability speak commands The software developers the kindle fire have elected omit this feature Other android devices use Apple has siri Shame you for not including the ability download speech,0.08199999999999999,0.816,0.10300000000000001,one appealing features mobile device ability speak commands the software developers kindle fire elected omit feature other android devices apple siri shame including ability download speech
277,B0051VVOB2,5,0,0,When bought the KINDLE read favorite books thought was the BEST thing EVER Then all sudden here comes the KINDLE FIRE Now think this the BEST thing ever REALLY enjoying the use Reading games internet etc,0.321,0.679,0.0,when bought kindle read favorite books thought best thing ever then sudden comes kindle fire now think best thing ever really enjoying reading games internet etc
278,B0051VVOB2,5,3,2,will start off saying that have never owned smart phone iPad other tablet haven used bought reader any kind this first experience with any this stuff bought the Kindle Fire primarily reader with extra capability watching streaming movies shows and music don intend use surf the web And does what want far have not actually purchased any Kindle books but have borrowed from the Amazon Prime Lending Library and also from library via Overdrive Checking books out and getting them the device very easy The standard settings for font size etc have worked very well for thus far and turning pages very easy with the touch screen like how the the books the device changes too you can hold either vertically For watching movies while the screen course smaller than computer the color and definition excellent and have had problems with the connection issues the media stalling some have reported perhaps more issue with the wireless connection than any fault Amazon itself Not sure One thing like that stop the show Kindle Fire midway through then resume watching knows where left off and resumes there The sound seems fine primarily use with headphones though downloaded several free apps for weather calorie counting few simple games MapQuest etc and those work quite well The color vibrant and haven had any issues with clumsiness the touch screen when using those have done little connecting the web mostly see how worked and there fault this would the webpages are not that easy see with much scrolling needed and pressing radio buttons and such are awkward with larger fingers hard for type the keyboard think stylus would make much easier but not anything didn expect given larger hands and also similar problem when have tried using the smaller keyboard laptop computer the QWERTY keyboard internet connected Not sure that there any way correct that problem Since don plan use the Kindle Fire for much web browsing this really isn issue for nice have the capability check mail and such when really needed and away from regular computer but not something will use for regularly far love and have really complaints but then didn expect work just like full service computer either not anything didn expect given larger hands and also similar problem when have tried using the smaller keyboard laptop computer the QWERTY keyboard internet connected Not sure that there any way correct that problem Since don plan use the Kindle Fire for much web browsing this really isn issue for nice have the capability check mail and such when really needed and away from regular computer but not something will use for regularly far love and have really complaints but then didn expect work just like full service computer either,0.11699999999999999,0.78,0.10300000000000001,start saying never owned smart phone ipad tablet used bought reader kind first experience stuff bought kindle fire primarily reader extra capability watching streaming movies shows music intend surf web and want far actually purchased kindle books borrowed amazon prime lending library also library via overdrive checking books getting device easy the standard settings font size etc worked well thus far turning pages easy touch screen like books device changes hold either vertically for watching movies screen course smaller computer color definition excellent problems connection issues media stalling reported perhaps issue wireless connection fault amazon not sure one thing like stop show kindle fire midway resume watching knows left resumes the sound seems fine primarily headphones though downloaded several free apps weather calorie counting simple games mapquest etc work quite well the color vibrant issues clumsiness touch screen using done little connecting web mostly see worked fault webpages easy see much scrolling needed pressing radio buttons awkward larger fingers hard type keyboard think stylus make much easier anything expect given larger hands also similar problem tried using smaller keyboard laptop computer qwerty keyboard internet connected not sure way correct problem since plan kindle fire much web browsing really issue nice capability check mail really needed away regular computer something regularly far love really complaints expect work like full service computer either anything expect given larger hands also similar problem tried using smaller keyboard laptop computer qwerty keyboard internet connected not sure way correct problem since plan kindle fire much web browsing really issue nice capability check mail really needed away regular computer something regularly far love really complaints expect work like full service computer either
279,B0083Q04IQ,5,0,0,Why buy the high priced Apple This the best for the right price and value does all,0.282,0.718,0.0,why buy high priced apple this best right price value
280,B0051VVOB2,3,9,2,Amazon announced system upgrade November Today December and received Kindle Fire which was ordered December with the system version unable connect wireless router which has multiple devices connected fully updated and restored factory defaults can update see can achieve blink have usb cable connect the Fire computer because seems require extra small one There are numerous threads numerous forums commenting issues with the Fire which may may not resolved order determine this will need pay more money for usb cable looking for wireless connection that works which guess means Star which irritating because think their coffee tastes burnt Thanks Amazon for reminding always wait for the second roll out any electronic device Let this again next year okay Not Edited January Maybe some you found this review unhelpful but didn got phone call from Amazon support offering help because they saw this review appreciate that like many others the solution that ended working was purchase new router really didn want that because there was nothing wrong with the old The combined cost puts close iPad territory kept the fire and have used heavy and the battery doesn last long but has had some usefulness trips still uncertain worthwhile purchase have revised review stars,0.11900000000000001,0.809,0.07200000000000001,amazon announced system upgrade november today december received kindle fire ordered december system version unable connect wireless router multiple devices connected fully updated restored factory defaults update see achieve blink usb cable connect fire computer seems require extra small one there numerous threads numerous forums commenting issues fire may may resolved order determine need pay money usb cable looking wireless connection works guess means star irritating think coffee tastes burnt thanks amazon reminding always wait second roll electronic device let next year okay not edited january maybe found review unhelpful phone call amazon support offering help saw review appreciate like many others solution ended working purchase new router really want nothing wrong old the combined cost puts close ipad territory kept fire used heavy battery last long usefulness trips still uncertain worthwhile purchase revised review stars
281,B0051VVOB2,5,2,2,not own iPhone iPad cost benefit not for least for now was actually looking for gadget read books and had looked previous Kindle models but had not been completely convinced When Amazon sent out pre order and the Fire was priced went for love read multiple reviews from users and CNet Washington Post name couple and agree serves the purpose bought for reading books and gives much more had not intended this for him but husband has taken half ownership now using read books search the web read news play games delighted with The screen size and sharpness great you can really see things well which plus for older people like The amount apps and know does not yet compare those available for Apple products but enough for are very happy with this purchase,0.191,0.78,0.028999999999999998,iphone ipad cost benefit least actually looking gadget read books looked previous kindle models completely convinced when amazon sent pre order fire priced went love read multiple reviews users cnet washington post name couple agree serves purpose bought reading books gives much intended husband taken half ownership using read books search web read news play games delighted the screen size sharpness great really see things well plus older people like the amount apps know yet compare available apple products enough happy purchase
282,B0051VVOB2,2,0,0,The port into which the electrical charging cable inserted became inoperable possibly because user tried insert the wrong cable clicked return replace this page but was told that the warranty had run out don mind paying have repaired but such option was offered Nothing wrong with the device except that can charge because the head the charging cable doesn fit into the port any more seems pity throw away device that works perfectly just because minor piece the cable interface has been bent out shape making impossible give new charge Isn there any way get repaired get part,0.042,0.85,0.10800000000000001,the port electrical charging cable inserted became inoperable possibly user tried insert wrong cable clicked return replace page told warranty run mind paying repaired option offered nothing wrong device except charge head charging cable fit port seems pity throw away device works perfectly minor piece cable interface bent shape making impossible give new charge isn way repaired part
283,B00BWYRF7E,4,0,0,Have lot learn Haven had long enough rate don sit and use seven This kindle starting from your first one The new one little lighter don like the off switch the back kindle especially with case have keep lifting get switch,0.0,0.968,0.032,have lot learn haven long enough rate sit seven this kindle starting first one the new one little lighter like switch back kindle especially case keep lifting switch
284,B0051VVOB2,4,4,3,have owned Ipad Archos Motorola Xoom Viewsonic Gtab Acer Iconia Nook Color and now the Kindle Fire not Apple guy but not hater either The Ipad wonderful device But bucks the bottom end not for everyone The build quality other Android devices really hurt them including the and the Gtab personal favorite the Acer Iconia but you are still talking DOUBLE the price the Kindle Fire really hard beat bucks has some glaring but has lot pluses well for the price point Basically you want spend bucks get Ipad you want Android premium tablet get Iconia Galaxy Tab the Xoom etc you want something around under Fire the best option for you Pros Design Build Quality Screen quality Amazon Simple interface Netflix App can hold one hand good for reading although not direct sunlight will fit your pocket most men larger pants decent battery life Cons Screen smaller than would like for watching movies both speakers one side device when watching landscape mode the way you watch all videos card slot camera gps HDMI out Google although you can sideload some apps and there Amazon AppStore physical volume buttons home key low storage amount,0.14400000000000002,0.741,0.115,owned ipad archos motorola xoom viewsonic gtab acer iconia nook color kindle fire apple guy hater either the ipad wonderful device but bucks bottom end everyone the build quality android devices really hurt including gtab personal favorite acer iconia still talking double price kindle fire really hard beat bucks glaring lot pluses well price point basically want spend bucks ipad want android premium tablet iconia galaxy tab xoom etc want something around fire best option pros design build quality screen quality amazon simple interface netflix app hold one hand good reading although direct sunlight fit pocket men larger pants decent battery life cons screen smaller like watching movies speakers one side device watching landscape mode way watch videos card slot camera gps hdmi google although sideload apps amazon appstore physical volume buttons home key low storage amount
285,B0051VVOB2,3,2,0,Setup little involved since have Kindle and had separate the devices but keep them under one account but each registered different person email you download Ebook found under BOOKS but you move Ebook from your goes under DOCS you download Video found under Video but you move Video from your goes under Gallery picture Does not make sense You can not remove items from the Main Screen you delete Book still shows the main screen would nice the Kindle came with Anti glare screen cover gave option have one put The Fire works well after you figure out,0.044000000000000004,0.935,0.021,setup little involved since kindle separate devices keep one account registered different person email download ebook found books move ebook goes docs download video found video move video goes gallery picture does make sense you remove items main screen delete book still shows main screen nice kindle came anti glare screen cover gave option one put the fire works well figure
286,B0051VVOB2,4,2,1,like the fire really haven had with except there books that have been reading that can download still hope they fix soon can finish the books,0.071,0.7929999999999999,0.136,like fire really except books reading download still hope fix soon finish books
287,B0083Q04IQ,1,1,0,The interface sluggish and only connects the limited Amazon app store was barely used Even under light use the charging port now loose and refuses charge can wait for tablets replace the,0.036000000000000004,0.8190000000000001,0.145,the interface sluggish connects limited amazon app store barely used even light charging port loose refuses charge wait tablets replace
288,B0083PWAPW,5,0,0,Bought this graduation present for myself and couldn happier keeps charge for quite while awesome display great wifi signal and easily used For reading web surfing just casual game playing you definitely can wrong with this product,0.33399999999999996,0.614,0.052000000000000005,bought graduation present happier keeps charge quite awesome display great wifi signal easily used for reading web surfing casual game playing definitely wrong product
289,B0083Q04IQ,4,0,0,liked except there was charger only USB cord Now have search for charger online for Amazon should have said this the promotion for Black Friday Otherwise smart buy,0.188,0.755,0.057,liked except charger usb cord now search charger online amazon said promotion black friday otherwise smart buy
290,B0051VVOB2,1,5,5,Many people are having problems with the charging ports the Kindle Fire Once the Kindle out warranty the customer out luck even though this defect the device and not caused user Amazon should the right thing and offer customers fix real discount not new one would caution anyone against buying Kindle,0.064,0.833,0.102,many people problems charging ports kindle fire once kindle warranty customer luck even though defect device caused user amazon right thing offer customers fix real discount new one caution anyone buying kindle
291,B0051VVOB2,5,5,3,Got the Fire for Xmas and couldn more pleased The internet and apps are fast with very little hesitation when clicked The screen just the right size and the colors graphics are really sharp think this great tablet and much better price than the iPad The only negative would say that there aren that many apps available but sure that will change time also like how there are buttons the device Cloud and Device like that you can access the Cloud right the Fire Huge time saver,0.15,0.7440000000000001,0.106,got fire xmas pleased the internet apps fast little hesitation clicked the screen right size colors graphics really sharp think great tablet much better price ipad the negative say many apps available sure change time also like buttons device cloud device like access cloud right fire huge time saver
