,product_id,star_rating,total_votes,helpful_votes,review_body,possentiment,neusentiment,negsentiment,reviews
447,B0083PWAPW,4,0,0,All all device The only issue have with using WiFi great and full bars one server but then with the same full bar strength perform much slower unable run certain content,0.17800000000000002,0.8220000000000001,0.0,all device the issue using wifi great full bars one server full bar strength perform much slower unable run certain content
448,B0083Q04IQ,3,20,18,KIndle Fire may great product but sister does not have computer charge and since there CHARGER included didn see that she cannot use until fully charged stuck until she can get store she old and doesn drive and spend another charger that certainly should included think this crappy decision Amazon cheap and crappy,0.067,0.741,0.192,kindle fire may great product sister computer charge since charger included see cannot fully charged stuck store old drive spend another charger certainly included think crappy decision amazon cheap crappy
449,B0083PWAPW,4,0,0,love this product and all the functions and apps that can used for However was that had seand this product back twice before got one that didn have messed charge port The first two that got would charge but only you held certain way and wiggled You had keep close eye would just start charging Ther third one that received does not that though and very satisfied with,0.11699999999999999,0.861,0.022000000000000002,love product functions apps used however seand product back twice one messed charge port the first two charge held certain way wiggled you keep close eye start charging ther third one received though satisfied
450,B0051VVOB2,4,2,0,fist you should not into the kindle thinking Ipad Yes close but Ipad What the kindle fire does does really well The Amazon prime service great Lots movies and other content right your finger tips The size perfect portable and carry everywhere the only thing wish this had was Tablet like interface but getting used the amazon layout also wish the power button was the top not the bottom find myself hitting while using the fire turning off the screan also wish there were actual volum buttons the side instead having use the software turn the volume down,0.235,0.7070000000000001,0.057999999999999996,fist kindle thinking ipad yes close ipad what kindle fire really well the amazon prime service great lots movies content right finger tips the size perfect portable carry everywhere thing wish tablet like interface getting used amazon layout also wish power button top bottom find hitting using fire turning screan also wish actual volum buttons side instead software turn volume
451,B0051VVOB2,2,12,2,purchased Kindle Fire leather case and Kindle gift card for old planned buy apps play games and read books Simple right ignorant assumed would similar his account buy the cards spend the money get games have fun buy Amazon app like Angry Birds free HAVE have credit debit card such with expiration date loaded into old account This back the Kindle gift card that already there just case wants purchases more than the gift card limit top off his Amazon com password characters show the screen before turning into asterisk for anyone see while types Wow and that designed into the software like have been there for that software red flag review Three hours four customer service reps online chat and telephone and none them knew the answers They were all scratching their heads too How about simply allowing someone purchase items with gift card that was properly purchased and redeemed that simply design Amazon seriously returning this device,0.151,0.78,0.069,purchased kindle fire leather case kindle gift card old planned buy apps play games read books simple right ignorant assumed similar account buy cards spend money games fun buy amazon app like angry birds free have credit debit card expiration date loaded old account this back kindle gift card already case wants purchases gift card limit top amazon com password characters show screen turning asterisk anyone see types wow designed software like software red flag review three hours four customer service reps online chat telephone none knew answers they scratching heads how simply allowing someone purchase items gift card properly purchased redeemed simply design amazon seriously returning device
452,B0051VVOB2,5,2,2,think that the kindle fire one the best great device that very thin and can almost anywhere want Con that has very small screen,0.204,0.7440000000000001,0.052000000000000005,think kindle fire one best great device thin almost anywhere want con small screen
453,B0051VVOB2,5,10,9,mom just came back from her North American trip with Kindle Fire Before buying she was worried wouldn work here the After months waiting and reading ALL the positive and negative reviews the web told her for She didn need any those expensive tablets All she wanted was something light and portable bring with her when travelling Just enough check her Facebook and email accounts surf the web and maybe play some games and read few magazines After having used since last week can truthfully write that this exactly what the Kindle Fire was built have say after setting the Fire for her was really wanting one own The Silk browser super fast Not buggy all like what the other reviewers have noted Reading blogs and articles has been really easy and the display fantastic used iPad iTouch and iPhone before and the display close enough that you wouldn really expect display good such cheap tablet also got few magazines for her read Digest Everyday Living Bon Petite and after hours reading the magazines and part novel room with light had eye strain complain about mom also tried reading the novel for few hours and was really pleased with how easy was read from She usually complains eye strain after reading from her laptop but she was very happy after reading from the Kindle Fire After reading lot complaints from different people about how lot Amazon services not working outside the decided try and see what exactly will and won work from here the Let first clarify that did use credit card with billing address make purchases over local address summarize the results experiment cloud services for work purchasing and from outside the work cloud services for books and news stand works purchases books and from news stand works streaming videos NOT WORK outside the but already knew this before buying the Kindle Fire purchasing and apps outside the ALSO WORKS for all those who are wondering please read and read this paragraph again any these are deal breakers for you terms purchasing the Fire then think hard For these services were just bonuses since lot the things wanted weren tied these services Regarding the apps available already downloaded about apps from Amazon and also from outside Amazon Just doing little research how was able load plenty apps from outside the Amazon app market without any rooting you really don want use any your mental faculties about loading apps then spend the extra few hundred dollars and buy more expensive tablet About the device itself the dual core chip super fast and the touch display has quick response time The inch display great for since just like holding book mom and wanted bigger display would using our netbooks The body solid and doesn feel badly made And for all those about the power button being easy pressed just turn the display upside down and problem solved Personally never had any problems with the power button and neither did mom With how great the Kindle Fire mom planning buy another one when she goes back the few months This time for use since keep borrowing her Kindle Fire can wait,0.11199999999999999,0.828,0.06,mom came back north american trip kindle fire before buying worried work after months waiting reading all positive negative reviews web told she need expensive tablets all wanted something light portable bring travelling just enough check facebook email accounts surf web maybe play games read magazines after used since last week truthfully write exactly kindle fire built say setting fire really wanting one the silk browser super fast not buggy like reviewers noted reading blogs articles really easy display fantastic used ipad itouch iphone display close enough really expect display good cheap tablet also magazines read digest everyday living bon petite hours reading magazines part novel room light eye strain complain mom also tried reading novel hours really pleased easy read she usually complains eye strain reading laptop happy reading kindle fire after reading lot complaints different people lot amazon services working outside decided try see exactly work let first clarify credit card billing address make purchases local address summarize results experiment cloud services work purchasing outside work cloud services books news stand works purchases books news stand works streaming videos not work outside already knew buying kindle fire purchasing apps outside also works wondering please read read paragraph deal breakers terms purchasing fire think hard for services bonuses since lot things wanted tied services regarding apps available already downloaded apps amazon also outside amazon just little research able load plenty apps outside amazon app market without rooting really want mental faculties loading apps spend extra hundred dollars buy expensive tablet about device dual core chip super fast touch display quick response time the inch display great since like holding book mom wanted bigger display using netbooks the body solid feel badly made and power button easy pressed turn display upside problem solved personally never problems power button neither mom with great kindle fire mom planning buy another one goes back months this time since keep borrowing kindle fire wait
454,B00BWYQ9YE,5,0,0,very happy with this Kindle After looking many different tablets think this the best choice for what was looking for,0.281,0.7190000000000001,0.0,happy kindle after looking many different tablets think best choice looking
455,B00BWYRF7E,5,1,1,love kindle best gift husband has given for Christmas everything check mail play games and read,0.43200000000000005,0.568,0.0,love kindle best gift husband given christmas everything check mail play games read
456,B0051VVOB2,5,6,6,did much research before choosing the Kindle Fire was first drawn the iPad course because all the hype went the Apple store and played around with shiny with lots bells and whistles However chose the Kindle Fire and don regret The most obvious upside this choice the money saved for the Kindle Fire for iPad Other benefits Movies and Amazon Prime Member enjoying free instant streaming movies and shows daily basis The quality excellent was blown away the first video watched The streaming great haven any lags freezing issues you have NetFlix account movies stream well from the NetFlix app well Decent Battery Life Battery life good You can easily get through full movie without worrying about losing juice also charges fairly quickly Weight The weight the Kindle Fire compared the newest even older models iPad wins hands down very light weight and use whether sitting laying down bed position The Fire also appears sturdy build that you won have worry about Surfing issues whatsoever while surfing the web Ease Use Even novice will able use the Kindle Fire out the box you need extra help Kindle Fire The Missing Manual can purchased for under think worth because gives you great tips for maximizing usage the Fire Extras The pricing for books movies and apps fantastic You can easily add your Kindle Fire without breaking the bank Regarding books built library only few weeks for FREE The free book downloads can beat There are also countless books that are and less Movie rentals are less expensive than Pay Per View Email reading and saving documents calendar contacts all here The speakers are stereo and music movies sound amazing you are looking for tablet create movies photoshop work this probably not for you and the iPad would better equipped for that However you want good all one tablet decent price for movie watching reading organizing surfing the web listening music with the Kindle Fire very happy with choice,0.175,0.763,0.062,much research choosing kindle fire first drawn ipad course hype went apple store played around shiny lots bells whistles however chose kindle fire regret the obvious upside choice money saved kindle fire ipad other benefits movies amazon prime member enjoying free instant streaming movies shows daily basis the quality excellent blown away first video watched the streaming great lags freezing issues netflix account movies stream well netflix app well decent battery life battery life good you easily full movie without worrying losing juice also charges fairly quickly weight the weight kindle fire compared newest even older models ipad wins hands light weight whether sitting laying bed position the fire also appears sturdy build worry surfing issues whatsoever surfing web ease use even novice able kindle fire box need extra help kindle fire the missing manual purchased think worth gives great tips maximizing usage fire extras the pricing books movies apps fantastic you easily add kindle fire without breaking bank regarding books built library weeks free the free book downloads beat there also countless books less movie rentals less expensive pay per view email reading saving documents calendar contacts the speakers stereo music movies sound amazing looking tablet create movies photoshop work probably ipad better equipped however want good one tablet decent price movie watching reading organizing surfing web listening music kindle fire happy choice
457,B00BWYQ9YE,5,0,0,Bought one for each our three children for Christmas along with mil spec cases protect them Couldn happier They kids lovethem and they didn break the bank Parental controls easy set are Amazon Prime members which adds lot what they can with them,0.159,0.795,0.046,bought one three children christmas along mil spec cases protect couldn happier they kids lovethem break bank parental controls easy set amazon prime members adds lot
458,B0083Q04IQ,5,0,0,daughter wanted the Kindle Fire for her Christmas present this year She loves and shares with her one year old son The price was great deal which purchased black friday,0.23,0.7140000000000001,0.055,daughter wanted kindle fire christmas present year she loves shares one year old son the price great deal purchased black friday
459,B0051VVOB2,5,6,3,husbands son loves read got this for him for christmas and just blowned away with and was showing what does and its unreal are both our but was easy understand and stuff said was the best christmas present had ever gotten takes with him where ever goes thanks again,0.196,0.804,0.0,husbands son loves read christmas blowned away showing unreal easy understand stuff said best christmas present ever gotten takes ever goes thanks
460,B0083Q04IQ,4,0,0,Its but kindle fire better your looking for camera the kindle fire there camera,0.185,0.509,0.306,its kindle fire better looking camera kindle fire camera
461,B0051VVOB2,2,15,7,Enough has been said about what has done right will only talk about three major flaws and they are big ones Memory Slot You only get for which gets eaten real quick when you start games Facebook Twitter Weather and you dip below the your Fire speed will cut half and you will get warning that you need delete something speed the Fire you really need subtract your Fire slows down and apps become unbearably slow THIS HUGE FLAW the Fire sure the Fire will come out with micro slot though The App Store This NOT the Android Play store this the Amazon Android store Apps usually are priced twice the amount you can get them your Android phone this simply not called for Also any App they may interfere with Amazon business model will blocked Amazon wants you shopping ONLY Amazon Web Browser The Fire does not allow you use any browser but modified version theirs Maxthon Mobile Web Browser Firefox and Google The Maxthon does run with the Google search bar but Amazon web browser always takes you their shopping page there you have MAJOR FLAWS that the Kindle Fire should not have been released with There are some minor flaws like camera and skype and ing but use Android for that but would use the Kindle Fire for those minor flaws well just out unless the Kindle Fire addresses the Major Flaws will going with some other type Reader Tablet such the Samsung Galaxy Tab,0.036000000000000004,0.836,0.128,enough said done right talk three major flaws big ones memory slot you eaten real quick start games facebook twitter weather dip fire speed cut half warning need delete something speed fire really need subtract fire slows apps become unbearably slow this huge flaw fire sure fire come micro slot though the app store this not android play store amazon android store apps usually priced twice amount android phone simply called also app may interfere amazon business model blocked amazon wants shopping only amazon web browser the fire allow browser modified version maxthon mobile web browser firefox google the maxthon run google search bar amazon web browser always takes shopping page major flaws kindle fire released there minor flaws like camera skype ing android kindle fire minor flaws well unless kindle fire addresses major flaws going type reader tablet samsung galaxy tab
462,B00BWYQ9YE,5,0,0,very happy with Kindle can read without eye strain even when husband sleeping beside can listen music when watching television The screen bright The controls are intuitive couldn happier,0.172,0.769,0.059000000000000004,happy kindle read without eye strain even husband sleeping beside listen music watching television the screen bright the controls intuitive happier
463,B00BWYQ9YE,5,2,0,This was gift for our and she loves very easy use that old can master all the and download her books,0.29600000000000004,0.7040000000000001,0.0,this gift loves easy old master download books
464,B0083Q04IQ,5,0,0,this was christmas present for daughter she was thrilled and when she discovered the screen wasnt quite right the return and reship new was thanks for the great service,0.18899999999999997,0.8109999999999999,0.0,christmas present daughter thrilled discovered screen wasnt quite right return reship new thanks great service
465,B0083PWAPW,5,0,0,got this christmas gift but ended returning because someone had already gifted still recommend this any apple product The screen perfect size and Reading great games are pretty cool internet browsing simple and once you figure out where all your settings and apps are even more user friendly,0.35100000000000003,0.649,0.0,christmas gift ended returning someone already gifted still recommend apple product the screen perfect size reading great games pretty cool internet browsing simple figure settings apps even user friendly
466,B0051VVOB2,1,6,1,The fact that purchases are not and cannot password protected perplexing say the least and for extremely bought this device for son his request his birthday present will don want him making purchases don want his friends making purchases and don want lost stolen and have someone else making purchases before can damage control What bad judgement call Amazon part Time for new update passwords are cool this day and age,0.021,0.7490000000000001,0.23,the fact purchases cannot password protected perplexing say least extremely bought device son request birthday present want making purchases want friends making purchases want lost stolen someone else making purchases damage control what bad judgement call amazon part time new update passwords cool day age
467,B0083PWAPW,4,1,0,love most features about this product and was relatively easy figure out Good variety apps Much easier read than the original Kindle and love color The one feature that seems missing the ability create your own categories sort and organize your books was the early model Kindles but haven figured out how that with this one,0.19899999999999998,0.78,0.02,love features product relatively easy figure good variety apps much easier read original kindle love color the one feature seems missing ability create categories sort organize books early model kindles figured one
468,B0083PWAPW,5,1,1,Best gift ever Gave these gift kids much they can Even has parental locks avoid over buying Nice apps for learning math too,0.34299999999999997,0.602,0.055,best gift ever gave gift kids much even parental locks avoid buying nice apps learning math
469,B0083PWAPW,5,2,1,Bought this Birthday gift for Wife She not computer savy showed her how get books read her email and other pluses while the she sales Told her stop McDonalds and keep with her office and she was very happy when she neede contract and got from the main office while the road Being avid reader she now can have any book magazine read while waiting see her customers,0.09699999999999999,0.879,0.024,bought birthday gift wife she computer savy showed books read email pluses sales told stop mcdonalds keep office happy neede contract main office road being avid reader book magazine read waiting see customers
470,B0051VVOB2,5,3,2,love Kindle Fire bedtime reader and much easier deal with than laptop and don always have books readily available read handy carry with when and such starter when pull out read Everyone loves the look and feel and know only begun tap into the can actually put fingertips have more research into what with books once have read them well the library borrow from This first touch screen product and would recommend anyone Another great feature being able adjust the brightness the screen well the size the font read Thank you for great product,0.193,0.792,0.015,love kindle fire bedtime reader much easier deal laptop always books readily available read handy carry starter pull read everyone loves look feel know begun tap actually put fingertips research books read well library borrow this first touch screen product recommend anyone another great feature able adjust brightness screen well size font read thank great product
471,B0051VVOB2,4,2,2,This device truly amazing but with few flaws One flaw would the lack exturnal buttons that control volume and other neccessary buttons without using the touch screen Besides the power the kindle fire soully touch screen But makes for other qualities such the new silk browser which better than expected runs smooth and the best part pre loads parts often visited sites The touch screen vary vibrant color and very responsive the heat sensored screen this device perfect for one hand cary though this device not the lightest lot small package,0.223,0.7340000000000001,0.043,this device truly amazing flaws one flaw lack exturnal buttons control volume neccessary buttons without using touch screen besides power kindle fire soully touch screen but makes qualities new silk browser better expected runs smooth best part pre loads parts often visited sites the touch screen vary vibrant color responsive heat sensored screen device perfect one hand cary though device lightest lot small package
472,B0051VVOB2,3,5,2,not rambler just list what don like bullet form fixed Back Home Buttons You surprised how annoying extra taps just get these basic functions Takes like taps spread out all over get volume controls Device much heavier than expected OMG Like none the games like are the App store Seriously NONE Felt like the wifi was too volatile have good wifi signal other devices home but dropped too often the Kindle Overall just found myself getting frustrated with Liked Battery life seemed really good for the two days had,0.098,0.779,0.12300000000000001,rambler list like bullet form fixed back home buttons you surprised annoying extra taps basic functions takes like taps spread volume controls device much heavier expected omg like none games like app store seriously none felt like wifi volatile good wifi signal devices home dropped often kindle overall found getting frustrated liked battery life seemed really good two days
473,B00BWYQ9YE,3,0,0,Does not have rear facing camera you are either taking selfie all the camera pictures you have hold over your head Otherwise works great couldn believe did not have rear facing camera and asked for help thought just couldn find the setting,0.049,0.951,0.0,does rear facing camera either taking selfie camera pictures hold head otherwise works great believe rear facing camera asked help thought find setting
474,B0083Q04IQ,5,0,0,bought this for year old son LOVE have the Amazon Prime membership son gets tons free games apps movies and books received Nook gift and wish had Kindle myself offers much more and many more free games apps,0.32899999999999996,0.6709999999999999,0.0,bought year old son love amazon prime membership son tons free games apps movies books received nook gift wish kindle offers much many free games apps
