,product_id,star_rating,total_votes,helpful_votes,review_body,possentiment,neusentiment,negsentiment,reviews
112,B0051VVOB2,2,7,0,you have parents who are accustomed computer and iPad they will have difficulty with the Kindle Fire and siblings are aways trying get work properly Sometimes and won even log had cost more than would return just get them the new iPad,0.0,0.9179999999999999,0.08199999999999999,parents accustomed computer ipad difficulty kindle fire siblings aways trying work properly sometimes even log cost return new ipad
113,B00BWYQ9YE,5,0,0,Was looking for something different people almost for the brand love kindle has the best apps the best books and the best amazon Keep the good work,0.45799999999999996,0.542,0.0,was looking something different people almost brand love kindle best apps best books best amazon keep good work
114,B00BWYQ9YE,4,0,0,This was purchased gift for wife She loved how easy was transfer her books from her old kindle,0.33799999999999997,0.662,0.0,this purchased gift wife she loved easy transfer books old kindle
115,B0051VVOB2,5,7,3,Love this device use stylus and helps with speed nook watch out this device dream Jeff genius can wait see what next,0.23600000000000002,0.764,0.0,love device stylus helps speed nook watch device dream jeff genius wait see next
116,B0051VVOB2,3,2,0,whim picked Kindle Fire today from SAMS and was pretty good the point not having any native Safari Books Online solid browser support for the site need more flexible reader looks like returning the unit this point that Amazon isn keen about supporting more that few content providers however not doing going show stopper for many Nice but not good enough,0.212,0.733,0.055,whim picked kindle fire today sams pretty good point native safari books online solid browser support site need flexible reader looks like returning unit point amazon keen supporting content providers however going show stopper many nice good enough
117,B0083PWAPW,5,0,0,use for class year old uses for games and purposes and husband uses watch videos and play games used around the clock,0.07400000000000001,0.9259999999999999,0.0,class year old uses games purposes husband uses watch videos play games used around clock
118,B0051VVOB2,3,6,1,The kindle fire compact and dazzling but the size means you want use one handed TOO heavy for one handed use for very long The touch perfect for one handed Feather light These purchases were for wife weight important ereader not iPad Amazon states that about the Fire also The iPad heaver but the size ideal for handed use lap hope Apple doesn create smaller iPad sure would have the same problem,0.185,0.72,0.095,the kindle fire compact dazzling size means want one handed too heavy one handed long the touch perfect one handed feather light these purchases wife weight important ereader ipad amazon states fire also the ipad heaver size ideal handed lap hope apple create smaller ipad sure problem
119,B0051VVOB2,5,3,3,received Kindle Fire March love everything about also own the Kindle with the keyboard and was amazed how all books over Kindle Fire had problems getting started and learning the FIRE was able right emails pandora and other apps with problems all sat Kindle Fire down and husband picked play with was amazed see everything that the Fire has offer guess will ordering another Kindle Fire for him shortly will never compare the Kindle Fire tablet notebook use Kindle Fire READ and listen pandora husband uses online and search the web LOVE,0.11199999999999999,0.696,0.192,received kindle fire march love everything also kindle keyboard amazed books kindle fire problems getting started learning fire able right emails pandora apps problems sat kindle fire husband picked play amazed see everything fire offer guess ordering another kindle fire shortly never compare kindle fire tablet notebook kindle fire read listen pandora husband uses online search web love
120,B00BWYRF7E,3,0,0,Hum worked all two days and was back Best Buys get kindle love Kindle but this ridiculous Four devices because they wouldn charge and Best Buys says well you get what you pay for have the new HDX will see how long this one lasts,0.226,0.7,0.07400000000000001,hum worked two days back best buys kindle love kindle ridiculous four devices charge best buys says well pay new hdx see long one lasts
121,B0051VVOB2,5,0,0,Bought this for she has loved Play all the time plan getting other one for her birthday,0.223,0.777,0.0,bought loved play time plan getting one birthday
122,B0083PWAPW,5,1,1,fast and covenant for needs There much more for learn about use have read more books the last few months than have the last twenty years The Bible program good although still learning how use properly,0.057,0.943,0.0,fast covenant needs there much learn read books last months last twenty years the bible program good although still learning properly
123,B0051VVOB2,3,8,0,Kindle not what you think the apps don always work right and say cants display this need throw Amazon get download What did get for free one month from Amazon anyway not bad display but you are confined use amazon most the time well that what you get for cheap price,0.19,0.81,0.0,kindle think apps always work right say cants display need throw amazon download what free one month amazon anyway bad display confined amazon time well cheap price
124,B0083PWAPW,5,3,2,What difference the screen and the color makes liked Kindle but this one blows away,0.11599999999999999,0.884,0.0,what difference screen color makes liked kindle one blows away
125,B0051VVOB2,5,4,2,have older Kindle and fight for home when the new one came out knew wanted for birthday but husband had read bad review online and wasn sure should get for but saw how much wanted and got for last week love after turning this year was getting hard for read the older Kindle especially night even with the light the cover but the Fire great just bright enough but not too bright love the ability download videos the picture sharp husband was really impresssed The sound amazing and anytime have been the web downloads the pages quickly with problems think the negative reviews are coming from people expecting tablet more than deluxe ereader cannot find anything about you loved the old Kindle you really love this one,0.205,0.659,0.136,older kindle fight home new one came knew wanted birthday husband read bad review online sure saw much wanted last week love turning year getting hard read older kindle especially night even light cover fire great bright enough bright love ability download videos picture sharp husband really impresssed the sound amazing anytime web downloads pages quickly problems think negative reviews coming people expecting tablet deluxe ereader cannot find anything loved old kindle really love one
126,B00BWYQ9YE,5,2,2,have had Kindle for just few days now and love bought Nook Color when they first came out and was still using every day that time Nook was walking all over Kindle seems that the Nook has not really gone anywhere since then The Kindle Fire HDX the other hand The Kindle fast has fantastic resolution great sound easy use problems got the model and bought keyboard cover with have REGRETS sure take advantage the FREE month Amazon Prime There are many good things about the Kindle Fire HDX great battery life free apps free books the list goes and know that sound like comercial for the Kindle but not just very satisfied customer,0.19,0.74,0.07,kindle days love bought nook color first came still using every day time nook walking kindle seems nook really gone anywhere since the kindle fire hdx hand the kindle fast fantastic resolution great sound easy problems model bought keyboard cover regrets sure take advantage free month amazon prime there many good things kindle fire hdx great battery life free apps free books list goes know sound like comercial kindle satisfied customer
127,B0083PWAPW,5,1,1,super delighted ordered the Kindel Fire for the lighted screen amazed every thing else does Thank,0.41200000000000003,0.511,0.077,super delighted ordered kindel fire lighted screen amazed every thing else thank
128,B00BWYQ9YE,3,0,0,owned two other Kindles before and absolutely loved them This one though bought Best Buy and returned about four weeks later because the screen dims even when automatic brightness Very they gave another one and does the same thing even called and talked Kindle tech about the problem and she tried help but still doing the same thing Best Buy told they wouldn accept return the second one because would past the return date very the quality this one compared the Kindle Fire,0.114,0.7609999999999999,0.126,owned two kindles absolutely loved this one though bought best buy returned four weeks later screen dims even automatic brightness very gave another one thing even called talked kindle tech problem tried help still thing best buy told accept return second one past return date quality one compared kindle fire
129,B0083PWAPW,4,0,0,far like Kindle Fire but still need learn all its have downloaded several free books use the email but would rather type messages laptop,0.16699999999999998,0.789,0.045,far like kindle fire still need learn downloaded several free books email rather type messages laptop
130,B0083PWAPW,5,0,0,bought this for sons birthday and awesome always played his sisters decided get him his own can use really well and absolutely love the parental controls,0.29100000000000004,0.7090000000000001,0.0,bought sons birthday awesome always played sisters decided really well absolutely love parental controls
131,B00BWYQ9YE,5,0,0,Better than can ever imagine Absolutely fantastic love the deals came with and much more Thank You,0.489,0.511,0.0,better ever imagine absolutely fantastic love deals came much thank you
132,B00BWYQ9YE,5,0,0,Mostly use kindle for audiobooks that can use while sewing walking treadmill haven had very long and still learning about the various things can with far very pleased,0.07400000000000001,0.9259999999999999,0.0,mostly kindle audiobooks sewing walking treadmill long still learning various things far pleased
133,B0083Q04IQ,5,0,0,really love Kindle Fire find actually read more than used read regular books probably because all the the bottom the screen like that tailors the the particular book reading instead just what popular right now only real complaint that the battery only lasts maybe three days just reading say hours day but have charge daily get the internet with Buyer beware you can just buy the Kindle Fire You have spend another ish screen protector like for smart phone plus wall adapter charger you stuck with charging computer with USB also opted purchase cover for was little more protected and could read propped all all spent another the screen protector the wall charger adapter and the cover,0.1,0.847,0.052000000000000005,really love kindle fire find actually read used read regular books probably bottom screen like tailors particular book reading instead popular right real complaint battery lasts maybe three days reading say hours day charge daily internet buyer beware buy kindle fire you spend another ish screen protector like smart phone plus wall adapter charger stuck charging computer usb also opted purchase cover little protected could read propped spent another screen protector wall charger adapter cover
134,B00BWYQ9YE,3,0,0,RETURNED JUST WANTED UPGRADE FIRST KINDLE CAME HOME WITH COMPUTOR YEARS OLD ENJOY KINDLE JUST WANTED COLOR AND LIKED THE DARK SCREEN WITH WHITE PRINT HUSBAND COULD READ BUT THE ALMOST KINDLE WAS MUCH AND CONFUSING SORRY TELL YOUR SALES PEOPLE MAKE SURE ALL DISPLAY KINDLES ARE WORKING AND DON TRY SELL EVERYONE YOU MAY LOSE THE SALE AND THE COSTOMER,0.1,0.778,0.122,returned just wanted upgrade first kindle came home with computor years old enjoy kindle just wanted color and liked the dark screen with white print husband could read but the almost kindle was much and confusing sorry tell your sales people make sure all display kindles are working and don try sell everyone you may lose the sale and the costomer
135,B0083PWAPW,4,1,1,The Kindle awesome companion take with when meeting friends for lunch dinner usually time while friends are usually running late don fidget look anxious anymore while waiting for friends just whip out Kindle and start read The picture crystal clear The color dynamic The only reason didn give stars because think the Kindle very user UNfriendly don think easy figure out recently took Kindle business trip and nice lady met provided with quick tutorial Don let that stop you You love your Kindle Fire,0.20800000000000002,0.72,0.07200000000000001,the kindle awesome companion take meeting friends lunch dinner usually time friends usually running late fidget look anxious anymore waiting friends whip kindle start read the picture crystal clear the color dynamic the reason give stars think kindle user unfriendly think easy figure recently took kindle business trip nice lady met provided quick tutorial don let stop you love kindle fire
136,B0083Q04IQ,5,0,0,bought this for sister who easy for her hold She loves reading books watching Netflix great,0.297,0.703,0.0,bought sister easy hold she loves reading books watching netflix great
137,B0083Q04IQ,3,0,0,nice quality product graphics easy used nice sounds apps works nice also the videos but can watch series movies cuz don work country too nice but not work prime amazon,0.309,0.691,0.0,nice quality product graphics easy used nice sounds apps works nice also videos watch series movies cuz work country nice work prime amazon
138,B0083PWAPW,4,0,0,because love the device but the camera mystery you can only see one side how you aim cant find for the camera and the pics did take are very grainy however love the device,0.18100000000000002,0.8190000000000001,0.0,love device camera mystery see one side aim cant find camera pics take grainy however love device
139,B00BWYQ9YE,4,1,0,VERY THE MAY DAY FEATURE DOES NOT WORK THE AUDIO WANT MAY DAY,0.16699999999999998,0.833,0.0,very the may day feature does not work the audio want may day
140,B0083Q04IQ,5,0,0,had older version which still enjoy son has one now and always enjoy the books movies and music and enjoys the games,0.272,0.728,0.0,older version still enjoy son one always enjoy books movies music enjoys games
141,B0083PWAPW,4,2,0,really like this product only concern that sometimes the screen small and when enlarged too large probably would have liked the larger size better but for book reading which what most the size and lighted screen are perfect,0.213,0.787,0.0,really like product concern sometimes screen small enlarged large probably liked larger size better book reading size lighted screen perfect
142,B0051VVOB2,2,8,4,received Kindle Fire for Christmas After several days playing with there are four serious have slow slow slow You never know you pushed did whatever the right thing because the response time such market android com stuff which for Android devices don work the Kindle Fire Real BUMMER expected Android stuff work Even lot Amazon downloads get red next Tom Kindle indicating that lot stuff they even offering doesn work Kindle Their newsreader Pulse displays the first para two article and then has button original article for continued reading Doesn work Period You would think even their newsreader would work wouldn you course the NBC news widget market android com won download install this stupid Fire either since not from Amazon really Lack software Lack Great hardware suppose but what can you with They going have long way make this thing usable,0.03,0.8740000000000001,0.09699999999999999,received kindle fire christmas after several days playing four serious slow slow slow you never know pushed whatever right thing response time market android com stuff android devices work kindle fire real bummer expected android stuff work even lot amazon downloads red next tom kindle indicating lot stuff even offering work kindle their newsreader pulse displays first para two article button original article continued reading doesn work period you think even newsreader work course nbc news widget market android com download install stupid fire either since amazon really lack software lack great hardware suppose they going long way make thing usable
143,B0083PWAPW,5,2,2,bought this birthday gift for and she loves She can listen her music connect Facebook etc,0.248,0.752,0.0,bought birthday gift loves she listen music connect facebook etc
144,B00BWYRF7E,5,2,2,purchased the Kindle Fire HDX with for old Kindle which had made its way into son bedroom never reappear avid reader did LOT research before made purchase and decided that this Kindle was the best fit for was not There are few drawbacks card slot board memory all you get This isn problem for since don have whole lot apps and cloud storage available LOVE the cloud storage Google apps are not supported Reportedly people have gotten them work their Kindle but wasn able get them going adapted get Gmail via browser and use alternate mapping app Battery life isn quite what like but manageable Now for the pros The size and weight just right use even hours end like Clear sharp images was quite impressed how good things look the Kindle Fire Cloud storage you get overloaded with apps books you can save them the cloud for later retrieval wide variety apps will run the Kindle Fire ranging from games Office apps Once got the Kindle Fire realized that how much use not only use for reading which lot but also have Skype several games and bunch work related use some work related tasks when not convenient computer With the apps collected can all work even work that requires VPN the Kindle that good admit that the Kindle Fire not for everyone you are expecting full blown tablet you may not like this total overkill all you want read books you absolutely MUST have the card slot MUST run Google apps then you should look elsewhere However you are looking read books and also watch movies play few games and run few apps then the Kindle Fire excellent choice ead books and also watch movies play few games and run few apps then the Kindle Fire excellent choice,0.129,0.82,0.051,purchased kindle fire hdx old kindle made way son bedroom never reappear avid reader lot research made purchase decided kindle best fit there drawbacks card slot board memory this problem since whole lot apps cloud storage available love cloud storage google apps supported reportedly people gotten work kindle able going adapted gmail via browser alternate mapping app battery life quite like manageable now pros the size weight right even hours end like clear sharp images quite impressed good things look kindle fire cloud storage overloaded apps books save cloud later retrieval wide variety apps run kindle fire ranging games office apps once kindle fire realized much reading lot also skype several games bunch work related work related tasks convenient computer with apps collected work even work requires vpn kindle good admit kindle fire everyone expecting full blown tablet may like total overkill want read books absolutely must card slot must run google apps look elsewhere however looking read books also watch movies play games run apps kindle fire excellent choice ead books also watch movies play games run apps kindle fire excellent choice
145,B0051VVOB2,5,0,0,used both the iPad and the Fire opinion the Fire not direct competitor the iPad The Fire lets what want quickly and easily Great apps email browsing are all easily done have read comments from some called usability experts about the size the touch screen and fat fingering input Well inch screen Smaller than the iPad will more compact wonder what qualifies one uasbility expert anyway That being said the device won please everyone you are looking for computer you will far books magazines movies music and apps run well has exceeded Measure the device against intended use and not wishful thinking EDIT want make sure that include hands experience with the Fire many the negative reviews fail owned Kindles one form another since version one This different machine altogether use every day for reading videos email work and mostly games have not had any interface issues Yes there are times that you need press more than once the touch screen But had this issue with other touch screen devices and given some experience you learn how touch the screen firm press for about seconds get work Browsing more than adequate comparable desktop computer But don expect However sufficient let browse what want where want and when want fast enough and have not had any issues with speed that consider out the ordinary Now for the button issues First happy there volume button the outside the unit One less thing hit and adjust while holding the Fire simple screen touch bring the volume for the power button never hit don know why this issue for some handle Fire case and outside the case well and have never turned off the Fire The app store has all that want have side loaded few apps that use Android phone the Fire that aren the Kindle App store Yahoo Fantasy Football for example You can that saving the executable file your computer and loading the Fire There are all over the net However find the selection apps sufficient and have issues with the store understand Amazon desire limit the number apps available and have some control over their ecosystem All all fantastic product for much that giving iPad son Just don need anymore typed Fire this issue for some handle Fire case and outside the case well and have never turned off the Fire The app store has all that want have side loaded few apps that use Android phone the Fire that aren the Kindle App store Yahoo Fantasy Football for example You can that saving the executable file your computer and loading the Fire There are all over the net However find the selection apps sufficient and have issues with the store understand Amazon desire limit the number apps available and have some control over their ecosystem All all fantastic product for much that giving iPad son Just don need anymore typed Fire,0.086,0.831,0.083,used ipad fire opinion fire direct competitor ipad the fire lets want quickly easily great apps email browsing easily done read comments called usability experts size touch screen fat fingering input well inch screen smaller ipad compact wonder qualifies one uasbility expert anyway that said device please everyone looking computer far books magazines movies music apps run well exceeded measure device intended wishful thinking edit want make sure include hands experience fire many negative reviews fail owned kindles one form another since version one this different machine altogether every day reading videos email work mostly games interface issues yes times need press touch screen but issue touch screen devices given experience learn touch screen firm press seconds work browsing adequate comparable desktop computer but expect however sufficient let browse want want want fast enough issues speed consider ordinary now button issues first happy volume button outside unit one less thing hit adjust holding fire simple screen touch bring volume power button never hit know issue handle fire case outside case well never turned fire the app store want side loaded apps android phone fire kindle app store yahoo fantasy football example you saving executable file computer loading fire there net however find selection apps sufficient issues store understand amazon desire limit number apps available control ecosystem all fantastic product much giving ipad son just need anymore typed fire issue handle fire case outside case well never turned fire the app store want side loaded apps android phone fire kindle app store yahoo fantasy football example you saving executable file computer loading fire there net however find selection apps sufficient issues store understand amazon desire limit number apps available control ecosystem all fantastic product much giving ipad son just need anymore typed fire
146,B0051VVOB2,4,1,1,gave husband this item for his birthday and really likes couldn wait play with and has already downloaded book have the Nook and switching the Kindle,0.081,0.865,0.053,gave husband item birthday really likes wait play already downloaded book nook switching kindle
147,B0083PWAPW,5,0,0,This tablet has been easy use and provides all the features needed including reader for books available local library,0.11199999999999999,0.888,0.0,this tablet easy provides features needed including reader books available local library
148,B0083PWAPW,5,1,1,great bargin Kindle Fire can much more with buying power Amazon Prime makes happen,0.214,0.518,0.268,great bargin kindle fire much buying power amazon prime makes happen
149,B0051VVOB2,5,1,1,This one the best buy that have made After checking out the other books the market this one beats them all Guess mite upgrade some day but not very soon Amazon had the best prices and there was state sales taxes paid,0.149,0.764,0.087,this one best buy made after checking books market one beats guess mite upgrade day soon amazon best prices state sales taxes paid
150,B00BWYQ9YE,2,2,0,like the Kindle Fire HDX and the display beautiful The battery however terrible get only hours battery life before needs recharged purchased this Kindle Janaury now August died shut off while was using and now won charge This should covered under the month warranty but Amazon doesn provide phone number for making for repair Not sure will purchase another Kindle since there absolutely customer service,0.06,0.813,0.126,like kindle fire hdx display beautiful the battery however terrible hours battery life needs recharged purchased kindle janaury august died shut using charge this covered month warranty amazon provide phone number making repair not sure purchase another kindle since absolutely customer service
